<?xml version="1.0"?>
<config xmlns:xsi="http://www.w3.org/2001/XMLSchema-instance" xsi:noNamespaceSchemaLocation="urn:magento:module:Vnecoms_PageBulder:etc/vcms_component.xsd">
	<components>
        <field name="h1">
        	<template>Vnecoms_PageBuilder/field/h1</template>
        	<edit_template>Vnecoms_PageBuilder/field/edit/h1</edit_template>
        	<component>Vnecoms_PageBuilder/js/field/text</component>
        	<class>Vnecoms\PageBuilder\Block\Field\Text</class>
        	<block_template>Vnecoms_PageBuilder::field/h1.phtml</block_template>
        </field>
        <field name="h2">
        	<template>Vnecoms_PageBuilder/field/h2</template>
        	<edit_template>Vnecoms_PageBuilder/field/edit/h2</edit_template>
        	<component>Vnecoms_PageBuilder/js/field/text</component>
        	<class>Vnecoms\PageBuilder\Block\Field\Text</class>
        	<block_template>Vnecoms_PageBuilder::field/h2.phtml</block_template>
        </field>
        <field name="h3">
        	<template>Vnecoms_PageBuilder/field/h3</template>
        	<edit_template>Vnecoms_PageBuilder/field/edit/h3</edit_template>
        	<component>Vnecoms_PageBuilder/js/field/text</component>
        	<class>Vnecoms\PageBuilder\Block\Field\Text</class>
        	<block_template>Vnecoms_PageBuilder::field/h3.phtml</block_template>
        </field>
        <field name="h4">
        	<template>Vnecoms_PageBuilder/field/h4</template>
        	<edit_template>Vnecoms_PageBuilder/field/edit/h4</edit_template>
        	<component>Vnecoms_PageBuilder/js/field/text</component>
        	<class>Vnecoms\PageBuilder\Block\Field\Text</class>
        	<block_template>Vnecoms_PageBuilder::field/h4.phtml</block_template>
        </field>
        <field name="h5">
        	<template>Vnecoms_PageBuilder/field/h5</template>
        	<edit_template>Vnecoms_PageBuilder/field/edit/h5</edit_template>
        	<component>Vnecoms_PageBuilder/js/field/text</component>
        	<class>Vnecoms\PageBuilder\Block\Field\Text</class>
        	<block_template>Vnecoms_PageBuilder::field/h5.phtml</block_template>
        </field>
        <field name="p">
        	<template>Vnecoms_PageBuilder/field/p</template>
        	<edit_template>Vnecoms_PageBuilder/field/edit/p</edit_template>
        	<component>Vnecoms_PageBuilder/js/field/html</component>
        	<class>Vnecoms\PageBuilder\Block\Field\Html</class>
        	<block_template>Vnecoms_PageBuilder::field/p.phtml</block_template>
        </field>
        <field name="div">
        	<template>Vnecoms_PageBuilder/field/div</template>
        	<edit_template>Vnecoms_PageBuilder/field/edit/div</edit_template>
        	<component>Vnecoms_PageBuilder/js/field/html</component>
        	<class>Vnecoms\PageBuilder\Block\Field\Html</class>
        	<block_template>Vnecoms_PageBuilder::field/div.phtml</block_template>
        </field>
        <field name="code">
        	<template>Vnecoms_PageBuilder/field/div</template>
        	<edit_template>Vnecoms_PageBuilder/field/edit/code</edit_template>
        	<component>Vnecoms_PageBuilder/js/field/code</component>
        	<class>Vnecoms\PageBuilder\Block\Field\Html</class>
        	<block_template>Vnecoms_PageBuilder::field/div.phtml</block_template>
        </field>
        <field name="editor">
        	<template>Vnecoms_PageBuilder/field/div</template>
        	<edit_template>Vnecoms_PageBuilder/field/edit/editor</edit_template>
        	<component>Vnecoms_PageBuilder/js/field/editor</component>
        	<class>Vnecoms\PageBuilder\Block\Field\Html</class>
        	<block_template>Vnecoms_PageBuilder::field/div.phtml</block_template>
        </field>
        <field name="link">
        	<template>Vnecoms_PageBuilder/field/link</template>
        	<edit_template>Vnecoms_PageBuilder/field/edit/link</edit_template>
        	<component>Vnecoms_PageBuilder/js/field/link</component>
        	<class>Vnecoms\PageBuilder\Block\Field\Link</class>
        	<block_template>Vnecoms_PageBuilder::field/link.phtml</block_template>
        </field>
        <field name="icon">
        	<template>Vnecoms_PageBuilder/field/icon</template>
        	<edit_template>Vnecoms_PageBuilder/field/edit/icon</edit_template>
        	<component>Vnecoms_PageBuilder/js/field/icon</component>
        	<class>Vnecoms\PageBuilder\Block\Field\Icon</class>
        	<block_template>Vnecoms_PageBuilder::field/icon.phtml</block_template>
        </field>
        <field name="group">
        	<template>Vnecoms_PageBuilder/field/group</template>
        	<edit_template>Vnecoms_PageBuilder/field/edit/group</edit_template>
        	<component>Vnecoms_PageBuilder/js/field/group</component>
        	<class>Vnecoms\PageBuilder\Block\Field\Group</class>
        	<block_template>Vnecoms_PageBuilder::field/group.phtml</block_template>
        </field>
        <field name="list">
        	<template>Vnecoms_PageBuilder/field/list</template>
        	<edit_template>Vnecoms_PageBuilder/field/edit/list</edit_template>
        	<component>Vnecoms_PageBuilder/js/field/list</component>
        	<class>Vnecoms\PageBuilder\Block\Field\ListBlock</class>
        	<block_template>Vnecoms_PageBuilder::field/list.phtml</block_template>
        </field>
		<field name="img">
        	<template>Vnecoms_PageBuilder/field/img</template>
        	<edit_template>Vnecoms_PageBuilder/field/edit/img</edit_template>
        	<component>Vnecoms_PageBuilder/js/field/img</component>
        	<class>Vnecoms\PageBuilder\Block\Field\Img</class>
        	<block_template>Vnecoms_PageBuilder::field/img.phtml</block_template>
        </field>
        <field name="container">
        	<template>Vnecoms_PageBuilder/field/container</template>
        	<edit_template>Vnecoms_PageBuilder/field/edit/container</edit_template>
        	<component>Vnecoms_PageBuilder/js/field/container</component>
        	<class>Vnecoms\PageBuilder\Block\Field\Container</class>
        	<block_template>Vnecoms_PageBuilder::field/container.phtml</block_template>
        </field>
    </components>
</config>
